Packet (Length: 64)
Layer USB:
	Source: host
	Destination: 1.1.0
	URB id: 0xffff8ec6a16cd840
	URB type: URB_SUBMIT ('S')
	URB transfer type: URB_CONTROL (0x02)
	Endpoint: 0x80, Direction: IN
	1... .... = Direction: IN (1)
	.... 0000 = Endpoint number: 0
	Device: 1
	URB bus id: 1
	Device setup request: relevant (0)
	Data: not present ('<')
	URB sec: 1628177463
	URB usec: 784407
	URB status: Operation now in progress (-EINPROGRESS) (-115)
	URB length [bytes]: 4
	Data length [bytes]: 0
	Interval: 0
	Start frame: 0
	Copy of Transfer Flags: 0x00000200, Dir IN
	.... .... .... .... .... .... .... ...0 = Short not OK: False
	.... .... .... .... .... .... .... ..0. = ISO ASAP: False
	.... .... .... .... .... .... .... .0.. = No transfer DMA map: False
	.... .... .... .... .... .... ..0. .... = No FSBR: False
	.... .... .... .... .... .... .0.. .... = Zero Packet: False
	.... .... .... .... .... .... 0... .... = No Interrupt: False
	.... .... .... .... .... ...0 .... .... = Free Buffer: False
	.... .... .... .... .... ..1. .... .... = Dir IN: True
	.... .... .... ...0 .... .... .... .... = DMA Map Single: False
	.... .... .... ..0. .... .... .... .... = DMA Map Page: False
	.... .... .... .0.. .... .... .... .... = DMA Map SG: False
	.... .... .... 0... .... .... .... .... = Map Local: False
	.... .... ...0 .... .... .... .... .... = Setup Map Single: False
	.... .... ..0. .... .... .... .... .... = Setup Map Local: False
	.... .... .0.. .... .... .... .... .... = DMA S-G Combined: False
	.... .... 0... .... .... .... .... .... = Aligned Temp Buffer: False
	Number of ISO descriptors: 0
	bInterfaceClass: Unknown (0xffff)
DATA

Packet (Length: 68)
Layer USB:
	Source: 1.1.0
	Destination: host
	URB id: 0xffff8ec6a16cd840
	URB type: URB_COMPLETE ('C')
	URB transfer type: URB_CONTROL (0x02)
	Endpoint: 0x80, Direction: IN
	1... .... = Direction: IN (1)
	.... 0000 = Endpoint number: 0
	Device: 1
	URB bus id: 1
	Device setup request: not relevant ('-')
	Data: present (0)
	URB sec: 1628177463
	URB usec: 784424
	URB status: Success (0)
	URB length [bytes]: 4
	Data length [bytes]: 4
	Request in: 1
	Time from request: 0.000017000 seconds
	Unused Setup Header
	Interval: 0
	Start frame: 0
	Copy of Transfer Flags: 0x00000200, Dir IN
	.... .... .... .... .... .... .... ...0 = Short not OK: False
	.... .... .... .... .... .... .... ..0. = ISO ASAP: False
	.... .... .... .... .... .... .... .0.. = No transfer DMA map: False
	.... .... .... .... .... .... ..0. .... = No FSBR: False
	.... .... .... .... .... .... .0.. .... = Zero Packet: False
	.... .... .... .... .... .... 0... .... = No Interrupt: False
	.... .... .... .... .... ...0 .... .... = Free Buffer: False
	.... .... .... .... .... ..1. .... .... = Dir IN: True
	.... .... .... ...0 .... .... .... .... = DMA Map Single: False
	.... .... .... ..0. .... .... .... .... = DMA Map Page: False
	.... .... .... .0.. .... .... .... .... = DMA Map SG: False
	.... .... .... 0... .... .... .... .... = Map Local: False
	.... .... ...0 .... .... .... .... .... = Setup Map Single: False
	.... .... ..0. .... .... .... .... .... = Setup Map Local: False
	.... .... .0.. .... .... .... .... .... = DMA S-G Combined: False
	.... .... 0... .... .... .... .... .... = Aligned Temp Buffer: False
	Number of ISO descriptors: 0
	bInterfaceClass: Unknown (0xffff)
DATADATA

Packet (Length: 64)
Layer USB:
	Source: host
	Destination: 1.1.0
	URB id: 0xffff8ec6a16cd840
	URB type: URB_SUBMIT ('S')
	URB transfer type: URB_CONTROL (0x02)
	Endpoint: 0x80, Direction: IN
	1... .... = Direction: IN (1)
	.... 0000 = Endpoint number: 0
	Device: 1
	URB bus id: 1
	Device setup request: relevant (0)
	Data: not present ('<')
	URB sec: 1628177463
	URB usec: 784431
	URB status: Operation now in progress (-EINPROGRESS) (-115)
	URB length [bytes]: 4
	Data length [bytes]: 0
	Interval: 0
	Start frame: 0
	Copy of Transfer Flags: 0x00000200, Dir IN
	.... .... .... .... .... .... .... ...0 = Short not OK: False
	.... .... .... .... .... .... .... ..0. = ISO ASAP: False
	.... .... .... .... .... .... .... .0.. = No transfer DMA map: False
	.... .... .... .... .... .... ..0. .... = No FSBR: False
	.... .... .... .... .... .... .0.. .... = Zero Packet: False
	.... .... .... .... .... .... 0... .... = No Interrupt: False
	.... .... .... .... .... ...0 .... .... = Free Buffer: False
	.... .... .... .... .... ..1. .... .... = Dir IN: True
	.... .... .... ...0 .... .... .... .... = DMA Map Single: False
	.... .... .... ..0. .... .... .... .... = DMA Map Page: False
	.... .... .... .0.. .... .... .... .... = DMA Map SG: False
	.... .... .... 0... .... .... .... .... = Map Local: False
	.... .... ...0 .... .... .... .... .... = Setup Map Single: False
	.... .... ..0. .... .... .... .... .... = Setup Map Local: False
	.... .... .0.. .... .... .... .... .... = DMA S-G Combined: False
	.... .... 0... .... .... .... .... .... = Aligned Temp Buffer: False
	Number of ISO descriptors: 0
	bInterfaceClass: Unknown (0xffff)
DATA

Packet (Length: 68)
Layer USB:
	Source: 1.1.0
	Destination: host
	URB id: 0xffff8ec6a16cd840
	URB type: URB_COMPLETE ('C')
	URB transfer type: URB_CONTROL (0x02)
	Endpoint: 0x80, Direction: IN
	1... .... = Direction: IN (1)
	.... 0000 = Endpoint number: 0
	Device: 1
	URB bus id: 1
	Device setup request: not relevant ('-')
	Data: present (0)
	URB sec: 1628177463
	URB usec: 784436
	URB status: Success (0)
	URB length [bytes]: 4
	Data length [bytes]: 4
	Request in: 3
	Time from request: 0.000005000 seconds
	Unused Setup Header
	Interval: 0
	Start frame: 0
	Copy of Transfer Flags: 0x00000200, Dir IN
	.... .... .... .... .... .... .... ...0 = Short not OK: False
	.... .... .... .... .... .... .... ..0. = ISO ASAP: False
	.... .... .... .... .... .... .... .0.. = No transfer DMA map: False
	.... .... .... .... .... .... ..0. .... = No FSBR: False
	.... .... .... .... .... .... .0.. .... = Zero Packet: False
	.... .... .... .... .... .... 0... .... = No Interrupt: False
	.... .... .... .... .... ...0 .... .... = Free Buffer: False
	.... .... .... .... .... ..1. .... .... = Dir IN: True
	.... .... .... ...0 .... .... .... .... = DMA Map Single: False
	.... .... .... ..0. .... .... .... .... = DMA Map Page: False
	.... .... .... .0.. .... .... .... .... = DMA Map SG: False
	.... .... .... 0... .... .... .... .... = Map Local: False
	.... .... ...0 .... .... .... .... .... = Setup Map Single: False
	.... .... ..0. .... .... .... .... .... = Setup Map Local: False
	.... .... .0.. .... .... .... .... .... = DMA S-G Combined: False
	.... .... 0... .... .... .... .... .... = Aligned Temp Buffer: False
	Number of ISO descriptors: 0
	bInterfaceClass: Unknown (0xffff)
DATADATA

Packet (Length: 64)
Layer USB:
	Source: host
	Destination: 1.1.1
	URB id: 0xffff8ec7028bf600
	URB type: URB_SUBMIT ('S')
	URB transfer type: URB_INTERRUPT (0x01)
	Endpoint: 0x81, Direction: IN
	1... .... = Direction: IN (1)
	.... 0001 = Endpoint number: 1
	Device: 1
	URB bus id: 1
	Device setup request: not relevant ('-')
	Data: not present ('<')
	URB sec: 1628177463
	URB usec: 784439
	URB status: Operation now in progress (-EINPROGRESS) (-115)
	URB length [bytes]: 4
	Data length [bytes]: 0
	bInterfaceClass: Unknown (0xffff)
	Unused Setup Header
	Interval: 2048
	Start frame: 0
	Copy of Transfer Flags: 0x00000200, Dir IN
	.... .... .... .... .... .... .... ...0 = Short not OK: False
	.... .... .... .... .... .... .... ..0. = ISO ASAP: False
	.... .... .... .... .... .... .... .0.. = No transfer DMA map: False
	.... .... .... .... .... .... ..0. .... = No FSBR: False
	.... .... .... .... .... .... .0.. .... = Zero Packet: False
	.... .... .... .... .... .... 0... .... = No Interrupt: False
	.... .... .... .... .... ...0 .... .... = Free Buffer: False
	.... .... .... .... .... ..1. .... .... = Dir IN: True
	.... .... .... ...0 .... .... .... .... = DMA Map Single: False
	.... .... .... ..0. .... .... .... .... = DMA Map Page: False
	.... .... .... .0.. .... .... .... .... = DMA Map SG: False
	.... .... .... 0... .... .... .... .... = Map Local: False
	.... .... ...0 .... .... .... .... .... = Setup Map Single: False
	.... .... ..0. .... .... .... .... .... = Setup Map Local: False
	.... .... .0.. .... .... .... .... .... = DMA S-G Combined: False
	.... .... 0... .... .... .... .... .... = Aligned Temp Buffer: False
	Number of ISO descriptors: 0


Packet (Length: 64)
Layer USB:
	Source: 1.5.1
	Destination: host
	URB id: 0xffff8ec679ccac00
	URB type: URB_COMPLETE ('C')
	URB transfer type: URB_INTERRUPT (0x01)
	Endpoint: 0x81, Direction: IN
	1... .... = Direction: IN (1)
	.... 0001 = Endpoint number: 1
	Device: 5
	URB bus id: 1
	Device setup request: not relevant ('-')
	Data: present (0)
	URB sec: 1628177609
	URB usec: 526108
	URB status: No such file or directory (-ENOENT) (-2)
	URB length [bytes]: 0
	Data length [bytes]: 0
	bInterfaceClass: Unknown (0xffff)
	Unused Setup Header
	Interval: 1
	Start frame: 0
	Copy of Transfer Flags: 0x00000300, Free Buffer, Dir IN
	.... .... .... .... .... .... .... ...0 = Short not OK: False
	.... .... .... .... .... .... .... ..0. = ISO ASAP: False
	.... .... .... .... .... .... .... .0.. = No transfer DMA map: False
	.... .... .... .... .... .... ..0. .... = No FSBR: False
	.... .... .... .... .... .... .0.. .... = Zero Packet: False
	.... .... .... .... .... .... 0... .... = No Interrupt: False
	.... .... .... .... .... ...1 .... .... = Free Buffer: True
	.... .... .... .... .... ..1. .... .... = Dir IN: True
	.... .... .... ...0 .... .... .... .... = DMA Map Single: False
	.... .... .... ..0. .... .... .... .... = DMA Map Page: False
	.... .... .... .0.. .... .... .... .... = DMA Map SG: False
	.... .... .... 0... .... .... .... .... = Map Local: False
	.... .... ...0 .... .... .... .... .... = Setup Map Single: False
	.... .... ..0. .... .... .... .... .... = Setup Map Local: False
	.... .... .0.. .... .... .... .... .... = DMA S-G Combined: False
	.... .... 0... .... .... .... .... .... = Aligned Temp Buffer: False
	Number of ISO descriptors: 0


Packet (Length: 64)
Layer USB:
	Source: 1.5.2
	Destination: host
	URB id: 0xffff8ec679cca6c0
	URB type: URB_COMPLETE ('C')
	URB transfer type: URB_BULK (0x03)
	Endpoint: 0x82, Direction: IN
	1... .... = Direction: IN (1)
	.... 0010 = Endpoint number: 2
	Device: 5
	URB bus id: 1
	Device setup request: not relevant ('-')
	Data: present (0)
	URB sec: 1628177609
	URB usec: 528467
	URB status: No such file or directory (-ENOENT) (-2)
	URB length [bytes]: 0
	Data length [bytes]: 0
	bInterfaceClass: Unknown (0xffff)
	Unused Setup Header
	Interval: 0
	Start frame: 0
	Copy of Transfer Flags: 0x00000300, Free Buffer, Dir IN
	.... .... .... .... .... .... .... ...0 = Short not OK: False
	.... .... .... .... .... .... .... ..0. = ISO ASAP: False
	.... .... .... .... .... .... .... .0.. = No transfer DMA map: False
	.... .... .... .... .... .... ..0. .... = No FSBR: False
	.... .... .... .... .... .... .0.. .... = Zero Packet: False
	.... .... .... .... .... .... 0... .... = No Interrupt: False
	.... .... .... .... .... ...1 .... .... = Free Buffer: True
	.... .... .... .... .... ..1. .... .... = Dir IN: True
	.... .... .... ...0 .... .... .... .... = DMA Map Single: False
	.... .... .... ..0. .... .... .... .... = DMA Map Page: False
	.... .... .... .0.. .... .... .... .... = DMA Map SG: False
	.... .... .... 0... .... .... .... .... = Map Local: False
	.... .... ...0 .... .... .... .... .... = Setup Map Single: False
	.... .... ..0. .... .... .... .... .... = Setup Map Local: False
	.... .... .0.. .... .... .... .... .... = DMA S-G Combined: False
	.... .... 0... .... .... .... .... .... = Aligned Temp Buffer: False
	Number of ISO descriptors: 0


Packet (Length: 64)
Layer USB:
	Source: 1.5.2
	Destination: host
	URB id: 0xffff8ec679cca240
	URB type: URB_COMPLETE ('C')
	URB transfer type: URB_BULK (0x03)
	Endpoint: 0x82, Direction: IN
	1... .... = Direction: IN (1)
	.... 0010 = Endpoint number: 2
	Device: 5
	URB bus id: 1
	Device setup request: not relevant ('-')
	Data: present (0)
	URB sec: 1628177609
	URB usec: 531734
	URB status: No such file or directory (-ENOENT) (-2)
	URB length [bytes]: 0
	Data length [bytes]: 0
	bInterfaceClass: Unknown (0xffff)
	Unused Setup Header
	Interval: 0
	Start frame: 0
	Copy of Transfer Flags: 0x00000300, Free Buffer, Dir IN
	.... .... .... .... .... .... .... ...0 = Short not OK: False
	.... .... .... .... .... .... .... ..0. = ISO ASAP: False
	.... .... .... .... .... .... .... .0.. = No transfer DMA map: False
	.... .... .... .... .... .... ..0. .... = No FSBR: False
	.... .... .... .... .... .... .0.. .... = Zero Packet: False
	.... .... .... .... .... .... 0... .... = No Interrupt: False
	.... .... .... .... .... ...1 .... .... = Free Buffer: True
	.... .... .... .... .... ..1. .... .... = Dir IN: True
	.... .... .... ...0 .... .... .... .... = DMA Map Single: False
	.... .... .... ..0. .... .... .... .... = DMA Map Page: False
	.... .... .... .0.. .... .... .... .... = DMA Map SG: False
	.... .... .... 0... .... .... .... .... = Map Local: False
	.... .... ...0 .... .... .... .... .... = Setup Map Single: False
	.... .... ..0. .... .... .... .... .... = Setup Map Local: False
	.... .... .0.. .... .... .... .... .... = DMA S-G Combined: False
	.... .... 0... .... .... .... .... .... = Aligned Temp Buffer: False
	Number of ISO descriptors: 0


Packet (Length: 64)
Layer USB:
	Source: host
	Destination: 1.2.0
	URB id: 0xffff8ec649b446c0
	URB type: URB_SUBMIT ('S')
	URB transfer type: URB_CONTROL (0x02)
	Endpoint: 0x00, Direction: OUT
	0... .... = Direction: OUT (0)
	.... 0000 = Endpoint number: 0
	Device: 2
	URB bus id: 1
	Device setup request: relevant (0)
	Data: present (0)
	URB sec: 1628177609
	URB usec: 531758
	URB status: Operation now in progress (-EINPROGRESS) (-115)
	URB length [bytes]: 0
	Data length [bytes]: 0
	Interval: 0
	Start frame: 0
	Copy of Transfer Flags: 0x00000000
	.... .... .... .... .... .... .... ...0 = Short not OK: False
	.... .... .... .... .... .... .... ..0. = ISO ASAP: False
	.... .... .... .... .... .... .... .0.. = No transfer DMA map: False
	.... .... .... .... .... .... ..0. .... = No FSBR: False
	.... .... .... .... .... .... .0.. .... = Zero Packet: False
	.... .... .... .... .... .... 0... .... = No Interrupt: False
	.... .... .... .... .... ...0 .... .... = Free Buffer: False
	.... .... .... .... .... ..0. .... .... = Dir IN: False
	.... .... .... ...0 .... .... .... .... = DMA Map Single: False
	.... .... .... ..0. .... .... .... .... = DMA Map Page: False
	.... .... .... .0.. .... .... .... .... = DMA Map SG: False
	.... .... .... 0... .... .... .... .... = Map Local: False
	.... .... ...0 .... .... .... .... .... = Setup Map Single: False
	.... .... ..0. .... .... .... .... .... = Setup Map Local: False
	.... .... .0.. .... .... .... .... .... = DMA S-G Combined: False
	.... .... 0... .... .... .... .... .... = Aligned Temp Buffer: False
	Number of ISO descriptors: 0
	bInterfaceClass: Unknown (0xffff)
DATA

Packet (Length: 64)
Layer USB:
	Source: host
	Destination: 1.5.0
	URB id: 0xffff8ec6b647d900
	URB type: URB_SUBMIT ('S')
	URB transfer type: URB_CONTROL (0x02)
	Endpoint: 0x00, Direction: OUT
	0... .... = Direction: OUT (0)
	.... 0000 = Endpoint number: 0
	Device: 5
	URB bus id: 1
	Device setup request: relevant (0)
	Data: present (0)
	URB sec: 1628177609
	URB usec: 531764
	URB status: Operation now in progress (-EINPROGRESS) (-115)
	URB length [bytes]: 0
	Data length [bytes]: 0
	Interval: 0
	Start frame: 0
	Copy of Transfer Flags: 0x00000000
	.... .... .... .... .... .... .... ...0 = Short not OK: False
	.... .... .... .... .... .... .... ..0. = ISO ASAP: False
	.... .... .... .... .... .... .... .0.. = No transfer DMA map: False
	.... .... .... .... .... .... ..0. .... = No FSBR: False
	.... .... .... .... .... .... .0.. .... = Zero Packet: False
	.... .... .... .... .... .... 0... .... = No Interrupt: False
	.... .... .... .... .... ...0 .... .... = Free Buffer: False
	.... .... .... .... .... ..0. .... .... = Dir IN: False
	.... .... .... ...0 .... .... .... .... = DMA Map Single: False
	.... .... .... ..0. .... .... .... .... = DMA Map Page: False
	.... .... .... .0.. .... .... .... .... = DMA Map SG: False
	.... .... .... 0... .... .... .... .... = Map Local: False
	.... .... ...0 .... .... .... .... .... = Setup Map Single: False
	.... .... ..0. .... .... .... .... .... = Setup Map Local: False
	.... .... .0.. .... .... .... .... .... = DMA S-G Combined: False
	.... .... 0... .... .... .... .... .... = Aligned Temp Buffer: False
	Number of ISO descriptors: 0
DATA

